{
  "$schema": "https://json-schema.org/draft/2020-12/schema",
  "$id": "stage-fix.schema.json",
  "title": "Provider stage output: fix",
  "type": "object",
  "required": ["summary", "files_changed", "risk_notes", "tests_added"],
  "properties": {
    "summary": { "type": "string" },
    "files_changed": { "type": "array", "items": { "type": "string" } },
    "risk_notes": { "type": "string" },
    "tests_added": { "type": "array", "items": { "type": "string" } }
  }
}
